{
  "attempt_artifact_digest": "sha256:3333333333333333333333333333333333333333333333333333333333333333",
  "closed_run_witness": {
    "observation": {
      "captured_observation_ref": {
        "digest": "sha256:dddddddddddddddddddddddddddddddddddddddddddddddddddddddddddddddd",
        "kind": "CAPTURED_OBSERVATION"
      },
      "observed_tuple": {
        "fields": [
          {
            "field_id": "cli.stdout.bytes",
            "value": {
              "base64": "b2sK",
              "tag": "BYTES"
            }
          }
        ]
      },
      "projection_result_ref": {
        "digest": "sha256:eeeeeeeeeeeeeeeeeeeeeeeeeeeeeeeeeeeeeeeeeeeeeeeeeeeeeeeeeeeeeeee",
        "kind": "PROJECTION_RESULT"
      },
      "status": "PROJECTED"
    },
    "private_evidence": {
      "aggregate_byte_count": 32,
      "blob_count": 1,
      "default_export": "OMITTED",
      "manifest_ref": {
        "digest": "sha256:ffffffffffffffffffffffffffffffffffffffffffffffffffffffffffffffff",
        "kind": "PRIVATE_EVIDENCE_MANIFEST"
      },
      "profile": "PRIVATE_EVIDENCE_MANIFEST_V1",
      "retention_at_finalization": "RETAINED_AT_FINALIZATION"
    },
    "process_closure": {
      "cleanup_controls": [],
      "evidence_refs": [
        {
          "digest": "sha256:8888888888888888888888888888888888888888888888888888888888888888",
          "kind": "MATERIALIZATION_REVALIDATION"
        },
        {
          "digest": "sha256:9999999999999999999999999999999999999999999999999999999999999999",
          "kind": "RUNTIME_REVALIDATION"
        },
        {
          "digest": "sha256:aaaaaaaaaaaaaaaaaaaaaaaaaaaaaaaaaaaaaaaaaaaaaaaaaaaaaaaaaaaaaaaa",
          "kind": "PROCESS_RESULT"
        },
        {
          "digest": "sha256:bbbbbbbbbbbbbbbbbbbbbbbbbbbbbbbbbbbbbbbbbbbbbbbbbbbbbbbbbbbbbbbb",
          "kind": "WAIT_RESULT"
        },
        {
          "digest": "sha256:cccccccccccccccccccccccccccccccccccccccccccccccccccccccccccccccc",
          "kind": "DRAIN_RESULT"
        },
        {
          "digest": "sha256:dddddddddddddddddddddddddddddddddddddddddddddddddddddddddddddddd",
          "kind": "TEARDOWN_RESULT"
        },
        {
          "digest": "sha256:eeeeeeeeeeeeeeeeeeeeeeeeeeeeeeeeeeeeeeeeeeeeeeeeeeeeeeeeeeeeeeee",
          "kind": "ORPHAN_CHECK"
        },
        {
          "digest": "sha256:ffffffffffffffffffffffffffffffffffffffffffffffffffffffffffffffff",
          "kind": "FINALIZATION_MARKER"
        }
      ],
      "primary_reason": "NONE",
      "status": "PROCESS_CLEAN"
    },
    "spawn_observation": {
      "pid": 4242,
      "status": "CHILD_PID_OBSERVED"
    },
    "standalone_scope": {
      "checks": [
        {
          "domain": "TARGET_INVENTORY",
          "evidence_ref": {
            "digest": "sha256:aaaaaaaaaaaaaaaaaaaaaaaaaaaaaaaaaaaaaaaaaaaaaaaaaaaaaaaaaaaaaaaa",
            "kind": "TARGET_INVENTORY"
          },
          "status": "PRESENT_CLEAN"
        },
        {
          "domain": "CHILD_BINDINGS",
          "evidence_ref": {
            "digest": "sha256:bbbbbbbbbbbbbbbbbbbbbbbbbbbbbbbbbbbbbbbbbbbbbbbbbbbbbbbbbbbbbbbb",
            "kind": "CHILD_BINDINGS"
          },
          "status": "PRESENT_CLEAN"
        },
        {
          "domain": "IMPORT_RESOLUTION",
          "evidence_ref": {
            "digest": "sha256:cccccccccccccccccccccccccccccccccccccccccccccccccccccccccccccccc",
            "kind": "IMPORT_RESOLUTION"
          },
          "status": "PRESENT_CLEAN"
        },
        {
          "domain": "SERVICE_BINDINGS",
          "evidence_ref": {
            "digest": "sha256:dddddddddddddddddddddddddddddddddddddddddddddddddddddddddddddddd",
            "kind": "SERVICE_BINDINGS"
          },
          "status": "PRESENT_CLEAN"
        },
        {
          "domain": "NAMED_PARENT_SECRET_SENTINEL_INHERITANCE",
          "evidence_ref": {
            "digest": "sha256:eeeeeeeeeeeeeeeeeeeeeeeeeeeeeeeeeeeeeeeeeeeeeeeeeeeeeeeeeeeeeeee",
            "kind": "NAMED_PARENT_SECRET_SENTINEL_INHERITANCE"
          },
          "status": "PRESENT_CLEAN"
        }
      ],
      "status": "COMPLETE"
    },
    "witness_version": "closed-run-witness/v1"
  },
  "contract_execution_target_digest": "sha256:46ab7870fd14b1b6b6215029dcf4ae450b3e8595a817627c35975a48479da6b9",
  "kind": "FinalizedContractRun",
  "publication_scope": "IMMUTABLE_NONHEAD_FINALIZED_RUN_V1",
  "run_version": "finalized-contract-run/v1",
  "schema_version": "countershape/v1",
  "start_claim_ref": {
    "digest": "sha256:9999999999999999999999999999999999999999999999999999999999999999",
    "kind": "StartClaim"
  }
}
